host,journal_name,seed_url,platform,mapped_adapter,article_container_selector,title_selector,article_url_selector,pdf_link_selector,author_selector,date_selector,volume_selector,pagination_type,next_page_selector,pagination_param,max_pages_checked,pages_visited,pdfs_found,smoke_result,csv_status,next_action,last_checked_utc,notes
mttlr.org,Michigan Technology Law Review,https://mttlr.org/archive/,wordpress-to-digitalcommons,MichiganTechnologyDualHostAdapter,".et_pb_text_inner table tr:has(a[href*=""/wp-content/journal/""]) ","td:first-child a[href*=""/wp-content/journal/""]",N/A,"td:first-child a[href*=""/wp-content/journal/""][href$="".pdf""]",td:nth-child(2),nearest preceding h3,.et_pb_text_inner h1,none,N/A,N/A,1,4,10,PASS_CURRENT; BACKFILE_PDF_403,active,Map the dual-host transition and locate Volumes 25-27 plus any print issues after Volume 28; seek an approved Digital Commons file lane.,2026-07-14T18:54:30Z,"Current WordPress article PDF passed at 607858 bytes and 60 pages; repository sitemap maps Volumes 1-24 with rich metadata but predecessor viewcontent returns the shared 744-byte 403 HTML."
scholarship.law.duke.edu,Duke Law & Technology Review,https://scholarship.law.duke.edu/dltr/all_issues.html,digitalcommons,DigitalCommonsIssueArticleHopAdapter,div.article-list div.doc,a.doctitle,a.doctitle,"div.doc p.pdf > a[href*=""context=dltr""]",div.doc span.auth,div.doc p.index_date,URL /vol{volume}/,none,N/A,N/A,1,3,20,HARD_FAIL: PDF_403,paused_waf,Run metadata-only Volumes 1-26 traversal and seek an approved Digital Commons binary route.,2026-07-14T18:54:30Z,"All issues and current article expose title, author, abstract, date, volume, issue, pages, citation, and subjects; normalized viewcontent returned the shared 744-byte 403 HTML."
georgetownlawtechreview.org,Georgetown Law Technology Review,https://georgetownlawtechreview.org/issues/,wordpress,GeorgetownLawTechnologyReviewAdapter,.issues--volume,"article.post h2, .slide--title a",".slide--title a, issue-page article cards","a.download-link[href$="".pdf""], article.post a[href*=""/wp-content/uploads/""][href$="".pdf""]","article.post title-adjacent author, .slide--author","article.post month/year, Cite as line",Cite as line,none,N/A,N/A,1,3,1,PASS,active,Sample Volume 1 and Volume 5 issue/article layouts and confirm the issue-page article selector before acquisition.,2026-07-14T18:54:30Z,"Issues index covers Volumes 1-10 (2016-2026); current note exposes title, author, abstract, date, citation, pages, and a 674067-byte 45-page PDF that passed application/pdf and %PDF-1.3."
jolt.law.harvard.edu,Harvard Journal of Law & Technology,https://jolt.law.harvard.edu/volumes,craft-cms-custom,HarvardJOLTAdapter,"div.volume__articles ul li, div.volume__notes ul li","div.volume__articles ul li > a[href$="".pdf""], div.volume__notes ul li > a[href$="".pdf""]",N/A,"div.volume__articles ul li > a[href$="".pdf""], div.volume__notes ul li > a[href$="".pdf""]",li text after PDF anchor and hyphen,"h2 season/year",h2 volume,none,N/A,N/A,1,1,17,PASS,active,Sample one middle and oldest sidebar volume and verify historical slug/layout variants.,2026-07-14T18:55:03Z,"Volume 39 exposes both issues for 2025-2026 with direct PDFs and 3/3 core metadata; representative 1181589-byte PDF passed application/pdf and %PDF-1.6."
btlj.org,Berkeley Technology Law Journal,https://btlj.org/category/journal/,wordpress,BerkeleyBTLJAdapter,section.cc-graf-block ul li,"section.cc-graf-block ul li a[href$="".pdf""]",N/A,"section.cc-graf-block ul li a[href$="".pdf""]",li text after by,Published On text,h1 Volume/Issue,unknown,N/A,N/A,0,2,8,PASS,active,Probe journal archive pagination plus one middle and oldest issue while retaining Crawl-delay 10.,2026-07-14T18:55:03Z,"Newest Volume 41 Issue 1 exposes complete issue, front matter, and six article PDFs with 3/3 core metadata; 923585-byte 64-page article PDF passed application/pdf and %PDF-1.7."
law.stanford.edu,Stanford Technology Law Review,https://law.stanford.edu/stanford-technology-law-review-stlr/stlr-archive/,wordpress,StanfordSTLRAdapter,"article[itemtype=""https://schema.org/ScholarlyArticle""]","a[itemprop=""url sameAs""]","a[itemprop=""url sameAs""]","a[itemprop=""url workExample""]","[itemprop=""author""] [itemprop=""name""]","time[itemprop=""datePublished""]","span[itemprop=""volumeNumber""]",query_param,N/A,_paged,0,0,0,HARD_FAIL: ROBOTS_CRAWL_DELAY_600,paused_robots,Schedule one delay-compliant archive request and later one PDF smoke before activation.,2026-07-14T18:55:03Z,"Robots permits the public path but mandates Crawl-delay 600; no journal page was fetched and all selectors remain provisional local StanfordSTLRAdapter evidence."
yjolt.org,Yale Journal of Law & Technology,https://yjolt.org/archive,drupal,YaleJOLTAdapter,div.view-current-issue div.views-row,.views-field-title h2.field-content > a,.views-field-title h2.field-content > a,".field-name-field-pdf .file a[type^=""application/pdf""]",.views-field-field-authors strong.field-content,N/A,.views-field-field-publishing-info em.field-content,none,N/A,N/A,1,3,1,PASS,active,Resolve publication year from archive labels or authoritative metadata and sample middle/oldest volumes.,2026-07-14T18:55:03Z,"Volume 28 exposes 16 titles, authors, citations/pages, and abstracts; author+volume give 2/3 core metadata and a 1171970-byte 8-page PDF passed application/pdf and %PDF-1.3."
journals.law.unc.edu,North Carolina Journal of Law & Technology,https://journals.law.unc.edu/ncjolt/articles/,wordpress,WordPressAcademicBaseAdapter,main#archive article.post,article.post header .title > a,article.post header .title > a,post content URL under /ncjolt/wp-content/uploads/sites/4/,N/A,article.post header span.date,article@class category-volume-{volume},numbered_pages,.navigation a.next.page-numbers,N/A,1,2,1,PASS,active_partial_metadata,Validate page 52 termination and historical article markup; add a verified author source.,2026-07-14T18:54:39Z,"Page 1 has 10 cards and page numbers through 52; article PDF ranged 206 with %PDF-1.3 and total size 543014 bytes. Title plus volume/year provide 2/3 core metadata; author is absent."
uclajolt.com,UCLA Journal of Law and Technology,https://uclajolt.com/,wordpress,WordPressAcademicBaseAdapter,article.wp-show-posts-single,article.wp-show-posts-single a[href*='vol-'],article.wp-show-posts-single a[href*='vol-'],article content URL ending .pdf under /wp-content/uploads/,N/A,article.wp-show-posts-single .wp-show-posts-entry-date,h1 suffix | Vol. {volume} No. {issue},unknown,N/A,N/A,0,2,1,PASS,active_partial_metadata,Map /articles/ termination and sample middle/oldest volume categories; add a verified author source.,2026-07-14T18:56:15Z,"Homepage exposes current/prior-volume cards and category links; article PDF ranged 206 with %PDF-1.3 and total size 632985 bytes. Title plus volume/year provide 2/3 core metadata; author is absent. robots.txt is a virtual HTTP 404 with a WordPress rules body."
scholarlycommons.law.northwestern.edu,Northwestern Journal of Technology and Intellectual Property,https://scholarlycommons.law.northwestern.edu/njtip/all_issues.html,digitalcommons,DigitalCommonsIssueArticleHopAdapter,div.article-list div.doc,div.doc p:not(.pdf) a[href*='/njtip/vol'],div.doc p:not(.pdf) a[href*='/njtip/vol'],"div.doc p.pdf a[href*='viewcontent.cgi'][href*='context=njtip']",div.doc span.auth,meta[name='bepress_citation_date'],meta[name='bepress_citation_volume'],none,N/A,N/A,1,3,4,HARD_FAIL: PDF_403,paused_waf,Run metadata-only all-issues traversal and seek an approved Digital Commons file route.,2026-07-14T18:58:40Z,"Archive exposes 23 volumes and 78 issues from 2003-2026; detail provides title, author, abstract, year, volume, issue, and first page. One ranged viewcontent request with Referer returned 744-byte HTTP 403 HTML."
